{
  "schemaVersion": "haiec-evaluation-export-1.0.0",
  "exportKind": "FROZEN_EVALUATION_EXPORT",
  "exportedAt": "2026-10-15T02:08:40.856Z",
  "provenance": {
    "dataClass": "SYNTHETIC_LAB",
    "truthLabel": "FROZEN_SYNTHETIC_EVALUATION",
    "sourceWorldId": "manufacturing-source-world-v1",
    "oracleIndependent": true,
    "producedBy": "AUTHORIZED_DB_READ",
    "note": "Synthetic lab corpus evaluated by the canonical HAIEC assurance engine. Not a real plant observation. Links require authorization to the owning organization."
  },
  "sourceCase": {
    "caseId": "SYS-SUP12-EVIDENCE_DEGRADED",
    "aiSystemId": "SYS-SUP12",
    "scenarioState": "EVIDENCE_DEGRADED",
    "scenarioRunId": "syn-world-sys-sup12-evidence_degraded"
  },
  "evaluation": {
    "schemaVersion": "master-report-product-1.0.0",
    "timeBasis": "EVALUATED_SNAPSHOT",
    "evaluationId": "ec13de38-d8b0-4699-97f8-ae46f31cac07:assurance:1.1",
    "aiSystemId": "SYS-SUP12",
    "disposition": "REVIEW",
    "methodologyVersion": "1.1",
    "profile": "BASE",
    "reportId": "master-report:ec13de38-d8b0-4699-97f8-ae46f31cac07:assurance:1.1",
    "reportVersion": "master-report-schema-1.0.0",
    "projectionVersion": "master-report-1.3.0",
    "coreTruthDigest": "6286b1ede33eb306a04a7f8854ed4d6fe7865efae7fb2414fb5560654feccb73",
    "evidenceBundleDigest": "096eb54863827148f7ea5dc72dd0b41354ebeeed3bb09d6e6297fc1c72ddf973",
    "evaluationBasis": "EVIDENCE_ONLY",
    "fourQuestions": {
      "schemaVersion": "assurance-questions-1.1.0",
      "evaluationId": "ec13de38-d8b0-4699-97f8-ae46f31cac07:assurance:1.1",
      "reach": {
        "question": "reach",
        "state": "NOT_ASSESSED",
        "summary": "HAIEC has not assessed what this system can reach in this evaluation.",
        "declared": [],
        "declaredFacts": [],
        "derived": [],
        "establishedReach": [],
        "partialReach": [],
        "unknown": [],
        "facts": [],
        "evidenceRefs": [],
        "limitations": [
          "ACTION_PATH_EVIDENCE_NOT_ASSESSED",
          "CODE_REACHABILITY_NOT_ASSESSED — no bound static scan.",
          "REACHABILITY_NOT_ASSESSED"
        ],
        "nextEvidence": []
      },
      "authority": {
        "question": "authority",
        "state": "NOT_ASSESSED",
        "summary": "Authority was not assessed for this evaluation.",
        "planes": {
          "requested": {
            "state": "NOT_ASSESSED",
            "pathCount": 0,
            "detail": "No evaluated action paths carry requested evidence."
          },
          "policyAuthorized": {
            "state": "NOT_ASSESSED",
            "pathCount": 0,
            "detail": "No evaluated action paths carry policy-authorized evidence."
          },
          "effectivelyGranted": {
            "state": "NOT_ASSESSED",
            "pathCount": 0,
            "detail": "No evaluated action paths carry effectively-granted evidence."
          },
          "codeCapable": {
            "state": "NOT_ASSESSED",
            "pathCount": 0,
            "detail": "No evaluated action paths carry code-capable evidence."
          },
          "observed": {
            "state": "NOT_ASSESSED",
            "pathCount": 0,
            "detail": "No evaluated action paths carry observed evidence."
          }
        },
        "authorityActions": [],
        "facts": [
          "No evaluated action paths carry requested evidence.",
          "No evaluated action paths carry policy-authorized evidence.",
          "No evaluated action paths carry effectively-granted evidence.",
          "No evaluated action paths carry code-capable evidence.",
          "No evaluated action paths carry observed evidence.",
          "Application authorization: NOT_ASSESSED (path join: NOT_ASSESSED).",
          "Execution identity: NOT_ASSESSED. Tenant object scope: NOT_ASSESSED.",
          "Provider authority: NOT_ASSESSED. Runtime observation: NOT_ASSESSED."
        ],
        "evidenceRefs": [],
        "limitations": [],
        "nextEvidence": []
      },
      "observed": {
        "question": "observed",
        "state": "NOT_ASSESSED",
        "summary": "HAIEC has not established that observed actions occurred in this evaluation — missing runtime evidence is not proof that nothing happened.",
        "observedActions": [],
        "facts": [],
        "evidenceRefs": [],
        "limitations": [
          "RUNTIME_OBSERVATION_NOT_ASSESSED"
        ],
        "nextEvidence": []
      },
      "proofBoundary": {
        "question": "proofBoundary",
        "state": "PARTIAL",
        "summary": "The proof stops at 5 unresolved evidence-frontier item(s) and 1 open evidence need(s) — listed verbatim.",
        "facts": [
          "5 evidence-frontier item(s) in state NOT_ASSESSED.",
          "Producer completion: COMPLETED.",
          "U5 reason codes: NOT_EVALUATED, REQUESTED_NOT_AUTHORIZED.",
          "Not assessed: AI-PROOF-003: File counts are not represented in this artifact",
          "Not assessed: AI-PROOF-012: Source → container continuity not established — repository analysis cannot see build or deployment attestation",
          "Not assessed: AI-PROOF-014: Exact action → execution identity binding not established — source defines code, not the deployed principal",
          "Not assessed: AI-PROOF-015: IAM authority not established by repository analysis — provider grants are external to source",
          "Not assessed: Agent Inventory: not established in this evidence basis — agentTopology: producer not connected to this basis",
          "Not assessed: How Each Agent Operates: not established in this evidence basis — executionArchetype: producer not connected to this basis",
          "Not assessed: Blast Radius / Shared Access: not established in this evidence basis — agentTopology: producer not connected to this basis; sharedSubstrate: producer not connected to this basis; egress: producer not connected to this basis; resourceScope: producer not connected to this basis",
          "Not assessed: Human Control and Delegated Authority: not established in this evidence basis — humanControl: producer not connected to this basis; delegatedAuthority: producer not connected to this basis",
          "Not assessed: Deferred, Persistent and Replayable Actions: not established in this evidence basis — deferredExecution: producer not connected to this basis; actionComposition: producer not connected to this basis; replay: producer not connected to this basis",
          "Not assessed: Memory, Retrieval and Model-Context Influence: not established in this evidence basis — memoryContext: producer not connected to this basis",
          "Not assessed: Evaluation Integrity / Self-Interest Surfaces: not established in this evidence basis — evaluationIntegrityAccess: producer not connected to this basis",
          "Not assessed: Security Posture: not established in this evidence basis — securityScan: producer not connected to this basis; consequenceDelta: producer not connected to this basis",
          "Not assessed: Sensitive Data and Data Boundary: not established in this evidence basis — memoryContext: producer not connected to this basis",
          "Not assessed: Recovery, Containment and Reversibility: not established in this evidence basis — deferredExecution: producer not connected to this basis",
          "Not assessed: Planner, Executor and Objective Continuity: not established in this evidence basis — delegatedAuthority: producer not connected to this basis",
          "Not assessed: Tool, MCP and Supply-Chain Provenance: not established in this evidence basis — capabilityChain: producer not connected to this basis",
          "Not assessed: Operational Auditability and Runtime Witness: not established in this evidence basis — provenance: producer not connected to this basis"
        ],
        "evidenceRefs": [],
        "limitations": [
          "A proof frontier does not establish the stronger runtime, authority, or deployment claim.",
          "Absence of a produced relation does not establish that the deployed provider has no such operation.",
          "CODE_REACHABILITY_NOT_ASSESSED — no source analysis evidence exists.",
          "CROSS_EVALUATION_COMPOSITION is invalid.",
          "Closing this requires provider permission evidence for the deployed principal; repository evidence cannot establish effective provider authority for an exact action/principal.",
          "EVIDENCE_ONLY_EVALUATION — evidence-bound sections only; scan-derived artifacts (Passport, operation coverage, constellation) are not produced.",
          "EVIDENCE_ONLY_EVALUATION — no static scan was bound to this evaluation.",
          "Hash integrity does not establish artifact origin authenticity.",
          "No qualifying evaluation of this claim occurred.",
          "Owning analyzer coverage is partial; this answer is bounded to the evidenced population.",
          "Repository file coverage is not present in the sanitized evaluated artifact.",
          "SOURCE_COVERAGE_COMPLETENESS_NOT_PROVEN — intake-bound coverage only."
        ],
        "nextEvidence": [
          "Requested capability was not established as authorized by policy evidence."
        ]
      }
    },
    "evaluationScenarioSnapshot": {
      "status": "PARTIAL",
      "scenarioRunIds": [
        "syn-world-sys-sup12-evidence_degraded"
      ],
      "scenarioRunId": "syn-world-sys-sup12-evidence_degraded",
      "stateOrder": [
        "STATE_2"
      ],
      "orderSource": "PRODUCER_SEQUENCE",
      "states": [
        {
          "scenarioLevel": "STATE_2",
          "sequence": 2,
          "evidenceCount": 5,
          "evidenceTypes": [
            "manufacturing.live_acceptance"
          ],
          "stateDigest": "4ed4a112255298178aa3269c44148b2822e27785090a1ea333d22179d3d6d700"
        }
      ],
      "transitions": [],
      "earliestEstablishedDivergence": "NOT_AVAILABLE",